<?xml version="1.0" encoding="UTF-8" standalone="no"?>
<!DOCTYPE algebras SYSTEM "algebras.dtd">
<algebras>
    <algebra name="2d">
        <definition>
            <bases>
                <zeroInf>
                    <baseVector name="1"/>
                    <baseVector name="e1"/>
                    <baseVector name="e2"/>
                </zeroInf>
                <plusMinus>
                    <baseVector name="1"/>
                    <baseVector name="e1"/>
                    <baseVector name="e2"/>
                </plusMinus>
            </bases>
            <signature>
                <square baseVector="e1" value="1"/>
                <square baseVector="e2" value="1"/>
            </signature>
            <transformations>
            </transformations>
        </definition>
        <description>
            <short value="2d GA" />
            <long value="Base vectors: e1,e2. Signature: {1,1}"/>
        </description>
    </algebra>    
    
    <algebra name="3d">
        <definition>
            <bases>
                <zeroInf>
                    <baseVector name="1"/>
                    <baseVector name="e1"/>
                    <baseVector name="e2"/>
                    <baseVector name="e3"/>
                </zeroInf>
                <plusMinus>
                    <baseVector name="1"/>
                    <baseVector name="e1"/>
                    <baseVector name="e2"/>
                    <baseVector name="e3"/>
                </plusMinus>
            </bases>
            <signature>
                <square baseVector="e1" value="1"/>
                <square baseVector="e2" value="1"/>
                <square baseVector="e3" value="1"/>
            </signature>
            <transformations>
            </transformations>
        </definition>
        <description>
            <short value="3d GA" />
            <long value="Base vectors: e1,e2,e3. Signature: {1,1,1}"/>
        </description>
    </algebra>
    
    <algebra name="cr4d">
        <definition>
            <bases>
                <zeroInf>
                    <baseVector name="1"/>
                    <baseVector name="e1"/>
                    <baseVector name="e2"/>
                    <baseVector name="einf"/>
                    <baseVector name="e0"/>
                </zeroInf>
                <plusMinus>
                    <baseVector name="1"/>
                    <baseVector name="e1"/>
                    <baseVector name="e2"/>
                    <baseVector name="ep"/>
                    <baseVector name="em"/>
                </plusMinus>
            </bases>
            <signature>
                <square baseVector="e1" value="1"/>
                <square baseVector="e2" value="1"/>
                <square baseVector="ep" value="1"/>
                <square baseVector="em" value="-1"/>
            </signature>
            <transformations>
                <zeroInfToPlusMinus>
                    <equation lhsBaseVector="ep">
                        <summand weight="0.5" baseVector="einf"/>
                        <summand weight="-1" baseVector="e0"/>
                    </equation>
                    <equation lhsBaseVector="em">
                        <summand weight="0.5" baseVector="einf"/>
                        <summand weight="1" baseVector="e0"/>
                    </equation>
                </zeroInfToPlusMinus>
                <plusMinusToZeroInf>
                    <equation lhsBaseVector="einf">
                        <summand weight="1" baseVector="em"/>
                        <summand weight="1" baseVector="ep"/>
                    </equation>
                    <equation lhsBaseVector="e0">
                        <summand weight="0.5" baseVector="em"/>
                        <summand weight="-0.5" baseVector="ep"/>
                    </equation>
                </plusMinusToZeroInf>
            </transformations>
        </definition>
        <description>
            <short value="4d Compass-Ruler" />
            <long value="Base vectors: e1,e2,einf,e0. Signature: {1,1,1,-1}"/>
        </description>
    </algebra>
    
    <algebra name="pr4d">
        <definition>
            <bases>
                <zeroInf>
                    <baseVector name="1"/>
                    <baseVector name="e1"/>
                    <baseVector name="e2"/>
                    <baseVector name="e3"/>
                    <baseVector name="e4"/>
                </zeroInf>
                <plusMinus>
                    <baseVector name="1"/>
                    <baseVector name="e1"/>
                    <baseVector name="e2"/>
                    <baseVector name="e3"/>
                    <baseVector name="e4"/>
                </plusMinus>
            </bases>
            <signature>
                <square baseVector="e1" value="1"/>
                <square baseVector="e2" value="1"/>
                <square baseVector="e3" value="1"/>
                <square baseVector="e4" value="1"/>
            </signature>
            <transformations>
            </transformations>
        </definition>
        <description>
            <short value="4d Projective" />
            <long value="Base vectors: e1,e2,e3,e4. Signature: {1,1,1,1}"/>
        </description>
    </algebra>
    
    <algebra name="st4d">
        <definition>
            <bases>
                <zeroInf>
                    <baseVector name="1"/>
                    <baseVector name="e1"/>
                    <baseVector name="e2"/>
                    <baseVector name="e3"/>
                    <baseVector name="e4"/>
                </zeroInf>
                <plusMinus>
                    <baseVector name="1"/>
                    <baseVector name="e1"/>
                    <baseVector name="e2"/>
                    <baseVector name="e3"/>
                    <baseVector name="e4"/>
                </plusMinus>
            </bases>
            <signature>
                <square baseVector="e1" value="1"/>
                <square baseVector="e2" value="-1"/>
                <square baseVector="e3" value="-1"/>
                <square baseVector="e4" value="-1"/>
            </signature>
            <transformations>
            </transformations>
        </definition>
        <description>
            <short value="4d Space-time" />
            <long value="Base vectors: e1,e2,e3,e4. Signature: {1,-1,-1,-1}"/>
        </description>
    </algebra>
    
    <algebra name="5d">
        <definition>
            <bases>
                <zeroInf>
                    <baseVector name="1"/>
                    <baseVector name="e1"/>
                    <baseVector name="e2"/>
                    <baseVector name="e3"/>
                    <baseVector name="einf"/>
                    <baseVector name="e0"/>
                </zeroInf>
                <plusMinus>
                    <baseVector name="1"/>
                    <baseVector name="e1"/>
                    <baseVector name="e2"/>
                    <baseVector name="e3"/>
                    <baseVector name="ep"/>
                    <baseVector name="em"/>
                </plusMinus>
            </bases>
            <signature>
                <square baseVector="e1" value="1"/>
                <square baseVector="e2" value="1"/>
                <square baseVector="e3" value="1"/>
                <square baseVector="ep" value="1"/>
                <square baseVector="em" value="-1"/>
            </signature>
            <transformations>
                <zeroInfToPlusMinus>
                    <equation lhsBaseVector="ep">
                        <summand weight="0.5" baseVector="einf"/>
                        <summand weight="-1" baseVector="e0"/>
                    </equation>
                    <equation lhsBaseVector="em">
                        <summand weight="0.5" baseVector="einf"/>
                        <summand weight="1" baseVector="e0"/>
                    </equation>
                </zeroInfToPlusMinus>
                <plusMinusToZeroInf>
                    <equation lhsBaseVector="einf">
                        <summand weight="1" baseVector="em"/>
                        <summand weight="1" baseVector="ep"/>
                    </equation>
                    <equation lhsBaseVector="e0">
                        <summand weight="0.5" baseVector="em"/>
                        <summand weight="-0.5" baseVector="ep"/>
                    </equation>
                </plusMinusToZeroInf>
            </transformations>
        </definition>
        <description>
            <short value="5d conformal GA" />
            <long value="Base vectors: e1,e2,e3,einf,e0. Signature: {1,1,1,1,-1}. Represents points, lines, circles, planes and spheres"/>
        </description>
    </algebra>
    
    <algebra name="6d">
        <definition>
            <bases>
                <zeroInf>
                    <baseVector name="1"/>
                    <baseVector name="e1"/>
                    <baseVector name="e2"/>
                    <baseVector name="e3"/>
                    <baseVector name="e4"/>
                    <baseVector name="e5"/>
                    <baseVector name="e6"/>
                </zeroInf>
                <plusMinus>
                    <baseVector name="1"/>
                    <baseVector name="e1"/>
                    <baseVector name="e2"/>
                    <baseVector name="e3"/>
                    <baseVector name="e4"/>
                    <baseVector name="e5"/>
                    <baseVector name="e6"/>
                </plusMinus>
            </bases>
            <signature>
                <square baseVector="e1" value="1"/>